{"$schema":"https://json-schema.org/draft/2020-12/schema","$id":"https://evidenceprose.local/schemas/prose_reader_contract.schema.json","title":"EvidenceProse prose reader contract","type":"object","additionalProperties":false,"required":["contract_version","article_id","handoff_digest","audience","purpose","reader_question","intended_takeaway","forbidden_takeaway","central_claim","evidence_weight","limitations","applicability","misuse_boundaries","resolution_source"],"properties":{"contract_version":{"const":"1.0"},"article_id":{"type":"string","minLength":1},"handoff_digest":{"type":"string","pattern":"^[a-f0-9]{64}$"},"audience":{"type":"string","minLength":1},"purpose":{"type":"string","minLength":1},"reader_question":{"type":"string","minLength":1},"intended_takeaway":{"type":"string","minLength":1},"forbidden_takeaway":{"type":"string","minLength":1},"central_claim":{"type":"string","minLength":1},"evidence_weight":{"type":"string","minLength":1},"limitations":{"type":"string","minLength":1},"applicability":{"type":"string","minLength":1},"misuse_boundaries":{"type":"string","minLength":1},"resolution_source":{"enum":["explicit_user","ta06_input","local_rendering_default"]},"local_default_is_user_fact":{"const":false}}}
